{
 "aliases": [
  "qwen-code",
  "qwen code"
 ],
 "id": "qwen",
 "min_engine_version": 2,
 "rules": [
  {
   "id": "osc_title_blocked",
   "priority": 1200,
   "regex": [
    "^\\x{2733}\\x{FE0E}? "
   ],
   "region": "osc_title",
   "state": "blocked",
   "visible_blocker": true
  },
  {
   "id": "osc_title_working",
   "priority": 1100,
   "regex": [
    "^\\x{25D0}\\x{FE0E}? "
   ],
   "region": "osc_title",
   "state": "working",
   "visible_working": true
  },
  {
   "any": [
    {
     "contains": [
      "Waiting for user confirmation..."
     ]
    },
    {
     "contains": [
      "等待用户确认..."
     ]
    },
    {
     "contains": [
      "等待用戶確認..."
     ]
    },
    {
     "contains": [
      "Warten auf Benutzerbestätigung..."
     ]
    },
    {
     "contains": [
      "En attente de la confirmation de l'utilisateur..."
     ]
    },
    {
     "contains": [
      "ユーザーの確認を待っています..."
     ]
    },
    {
     "contains": [
      "Aguardando confirmação do usuário..."
     ]
    },
    {
     "contains": [
      "Ожидание подтверждения от пользователя..."
     ]
    },
    {
     "contains": [
      "Esperant la confirmació de l'usuari..."
     ]
    }
   ],
   "id": "waiting_for_confirmation",
   "line_regex": [
    "^\\s*⠏\\s+.*\\.\\.\\.\\s*$"
   ],
   "priority": 1000,
   "region": "bottom_non_empty_lines(20)",
   "state": "blocked",
   "visible_blocker": true
  },
  {
   "any": [
    {
     "contains": [
      "apply this change?"
     ]
    },
    {
     "contains": [
      "allow execution of:"
     ]
    },
    {
     "contains": [
      "allow execution of mcp tool"
     ]
    },
    {
     "contains": [
      "do you want to proceed?"
     ]
    },
    {
     "contains": [
      "shell command execution"
     ]
    }
   ],
   "contains": [
    "yes, allow once"
   ],
   "id": "tool_confirmation",
   "priority": 990,
   "region": "bottom_non_empty_lines(20)",
   "state": "blocked",
   "visible_blocker": true
  },
  {
   "id": "question_dialog",
   "line_regex": [
    "^\\s*[❯›]\\s*(?:\\[(?: |✓)\\]\\s*)?\\d+\\.\\s+",
    "^\\s*↑/↓\\s*:.*(?:Enter|Return)\\s*:"
   ],
   "priority": 980,
   "region": "bottom_non_empty_lines(20)",
   "state": "blocked",
   "visible_blocker": true
  },
  {
   "contains": [
    "do you trust this folder?",
    "trust folder (",
    "don't trust (esc)"
   ],
   "id": "folder_trust_dialog",
   "priority": 970,
   "region": "bottom_non_empty_lines(20)",
   "state": "blocked",
   "visible_blocker": true
  },
  {
   "id": "cancel_hint_working",
   "line_regex": [
    "^\\s*(?:[⠁-⣿]|\\.{1,2})\\s+.*\\(\\d+(?:m(?:\\s+\\d+s)?|s).*\\s·\\sesc to cancel\\)\\s*$"
   ],
   "priority": 900,
   "region": "bottom_non_empty_lines(8)",
   "state": "working",
   "visible_working": true
  },
  {
   "id": "narrow_cancel_hint_working",
   "line_regex": [
    "^\\s*\\(\\d+(?:m(?:\\s+\\d+s)?|s)\\s·\\sesc to cancel\\)\\s*$"
   ],
   "priority": 890,
   "region": "bottom_non_empty_lines(8)",
   "state": "working",
   "visible_working": true
  },
  {
   "id": "osc_tool_progress_working",
   "priority": 850,
   "regex": [
    "^4;3(?:;|$)"
   ],
   "region": "osc_progress",
   "state": "working",
   "visible_working": true
  },
  {
   "any": [
    {
     "contains": [
      "type your message"
     ]
    },
    {
     "contains": [
      "your message or @path/to/file"
     ]
    },
    {
     "contains": [
      "@path/to/file"
     ]
    },
    {
     "contains": [
      "type",
      "mes",
      "sage",
      "@pat",
      "h/to",
      "/fil"
     ]
    }
   ],
   "id": "composer_idle",
   "line_regex": [
    "^\\s*>\\s*(?:type\\s*)?.*$"
   ],
   "priority": 100,
   "region": "bottom_non_empty_lines(30)",
   "state": "idle",
   "visible_idle": true
  }
 ],
 "updated_at": "2026-08-14T00:00:00Z",
 "version": "2026.08.14.1"
}