{
 "aliases": [
  "hermes-agent"
 ],
 "id": "hermes",
 "min_engine_version": 2,
 "rules": [
  {
   "id": "osc_title_blocked",
   "priority": 1100,
   "regex": [
    "^⚠[\\u{fe0e}\\u{fe0f}]?(?:\\s|$)"
   ],
   "region": "osc_title",
   "state": "blocked",
   "visible_blocker": true
  },
  {
   "id": "osc_title_working",
   "priority": 1050,
   "regex": [
    "^⏳[\\u{fe0e}\\u{fe0f}]?(?:\\s|$)"
   ],
   "region": "osc_title",
   "state": "working",
   "visible_working": true
  },
  {
   "all": [
    {
     "any": [
      {
       "contains": [
        "enter confirm"
       ]
      },
      {
       "contains": [
        "enter to confirm"
       ]
      },
      {
       "contains": [
        "↑/↓ to select"
       ]
      },
      {
       "contains": [
        "show full command"
       ]
      }
     ]
    }
   ],
   "any": [
    {
     "contains": [
      "dangerous"
     ]
    },
    {
     "contains": [
      "approval"
     ]
    },
    {
     "contains": [
      "allow once",
      "deny"
     ]
    },
    {
     "line_regex": [
      "(?i)^\\s*[▸>]?\\s*1\\.\\s*allow"
     ]
    }
   ],
   "id": "dangerous_command_approval",
   "priority": 900,
   "region": "bottom_non_empty_lines(14)",
   "state": "blocked",
   "visible_blocker": true
  },
  {
   "all": [
    {
     "any": [
      {
       "contains": [
        "enter confirm"
       ]
      },
      {
       "contains": [
        "enter to confirm"
       ]
      },
      {
       "contains": [
        "enter send"
       ]
      },
      {
       "contains": [
        "press enter"
       ]
      },
      {
       "contains": [
        "↑/↓ select"
       ]
      },
      {
       "contains": [
        "↑/↓ to select"
       ]
      },
      {
       "contains": [
        "other (type"
       ]
      }
     ]
    }
   ],
   "any": [
    {
     "contains": [
      "hermes needs your"
     ]
    },
    {
     "line_regex": [
      "^\\s*ask\\s+\\S"
     ]
    },
    {
     "contains": [
      "type your answer"
     ]
    }
   ],
   "id": "clarification_prompt",
   "priority": 900,
   "region": "bottom_non_empty_lines(14)",
   "state": "blocked",
   "visible_blocker": true
  },
  {
   "any": [
    {
     "contains": [
      "sudo password"
     ]
    },
    {
     "contains": [
      "skill setup"
     ]
    },
    {
     "contains": [
      "🔑",
      "for "
     ]
    }
   ],
   "id": "credential_prompt",
   "priority": 900,
   "region": "bottom_non_empty_lines(14)",
   "state": "blocked",
   "visible_blocker": true
  },
  {
   "all": [
    {
     "any": [
      {
       "contains": [
        "approve once",
        "cancel"
       ]
      },
      {
       "contains": [
        "start a new session",
        "keep going"
       ]
      }
     ]
    },
    {
     "any": [
      {
       "contains": [
        "enter to confirm"
       ]
      },
      {
       "contains": [
        "enter confirm"
       ]
      },
      {
       "contains": [
        "type 1/2/3"
       ]
      },
      {
       "contains": [
        "y/n quick"
       ]
      }
     ]
    }
   ],
   "id": "confirmation_prompt",
   "priority": 900,
   "region": "bottom_non_empty_lines(14)",
   "state": "blocked",
   "visible_blocker": true
  },
  {
   "any": [
    {
     "contains": [
      "msg=interrupt"
     ]
    },
    {
     "contains": [
      "ctrl+c to interrupt"
     ]
    }
   ],
   "id": "interrupt_status_working",
   "priority": 950,
   "region": "bottom_non_empty_lines(5)",
   "state": "working",
   "visible_working": true
  },
  {
   "contains": [
    "ctrl+c cancel"
   ],
   "id": "classic_cancel_working",
   "priority": 500,
   "region": "bottom_non_empty_lines(5)",
   "state": "working",
   "visible_working": true
  },
  {
   "id": "osc_title_idle",
   "priority": 100,
   "regex": [
    "^✓[\\u{fe0e}\\u{fe0f}]?(?:\\s|$)"
   ],
   "region": "osc_title",
   "state": "idle",
   "visible_idle": true
  }
 ],
 "updated_at": "2026-07-24T19:12:54Z",
 "version": "2026.07.24.1"
}