{
 "aliases": [
  "devin-cli",
  "devin cli"
 ],
 "id": "devin",
 "min_engine_version": 1,
 "rules": [
  {
   "contains": [
    "do you trust the authors of this directory?",
    "with untrusted content.",
    "yes, trust "
   ],
   "id": "workspace_trust_prompt",
   "priority": 300,
   "region": "bottom_non_empty_lines(8)",
   "state": "blocked",
   "visible_blocker": true
  },
  {
   "contains": [
    "approve once",
    "select",
    "confirm",
    "esc cancel"
   ],
   "id": "permission_prompt",
   "priority": 290,
   "region": "bottom_non_empty_lines(8)",
   "state": "blocked",
   "visible_blocker": true
  },
  {
   "contains": [
    "running tools",
    "esc to interrupt"
   ],
   "id": "running_tools_footer",
   "not": [
    {
     "contains": [
      "approve once",
      "esc cancel"
     ]
    }
   ],
   "priority": 200,
   "region": "bottom_non_empty_lines(8)",
   "state": "working",
   "visible_working": true
  },
  {
   "contains": [
    "guide devin while it works"
   ],
   "id": "guide_while_working",
   "not": [
    {
     "contains": [
      "approve once",
      "esc cancel"
     ]
    }
   ],
   "priority": 190,
   "region": "bottom_non_empty_lines(6)",
   "state": "working",
   "visible_working": true
  },
  {
   "contains": [
    "reading shell ",
    "timeout:"
   ],
   "id": "tool_reading_timeout",
   "not": [
    {
     "contains": [
      "approve once",
      "esc cancel"
     ]
    }
   ],
   "priority": 180,
   "region": "bottom_non_empty_lines(8)",
   "state": "working",
   "visible_working": true
  },
  {
   "contains": [
    "ask devin to build",
    "features, fix bugs",
    "your code"
   ],
   "id": "welcome_prompt_footer",
   "line_regex": [
    "^\\s*❭ Ask Devin to build"
   ],
   "not": [
    {
     "contains": [
      "approve once",
      "esc cancel"
     ]
    },
    {
     "contains": [
      "running tools",
      "esc to interrupt"
     ]
    },
    {
     "contains": [
      "guide devin while it works"
     ]
    }
   ],
   "priority": 120,
   "region": "bottom_non_empty_lines(8)",
   "state": "idle",
   "visible_idle": true
  },
  {
   "contains": [
    "context:"
   ],
   "id": "live_prompt_footer",
   "line_regex": [
    "^\\s*❭"
   ],
   "not": [
    {
     "contains": [
      "approve once",
      "esc cancel"
     ]
    },
    {
     "contains": [
      "running tools",
      "esc to interrupt"
     ]
    },
    {
     "contains": [
      "guide devin while it works"
     ]
    }
   ],
   "priority": 100,
   "region": "bottom_non_empty_lines(6)",
   "state": "idle",
   "visible_idle": true
  }
 ],
 "updated_at": "2026-06-15T00:00:00Z",
 "version": "2026.06.15.1"
}