{
 "aliases": [
  "amp-local"
 ],
 "id": "amp",
 "min_engine_version": 2,
 "rules": [
  {
   "contains": [
    "Plugin confirmation needed"
   ],
   "id": "osc_title_plugin_confirmation_blocked",
   "priority": 1100,
   "region": "osc_title",
   "state": "blocked",
   "visible_blocker": true
  },
  {
   "id": "osc_title_working",
   "priority": 1050,
   "regex": [
    "^[\\x{2800}-\\x{28FF}] "
   ],
   "region": "osc_title",
   "state": "working",
   "visible_working": true
  },
  {
   "any": [
    {
     "contains": [
      "waiting for approval"
     ]
    },
    {
     "contains": [
      "invoke tool"
     ]
    },
    {
     "contains": [
      "run this command?"
     ]
    },
    {
     "contains": [
      "allow editing file:"
     ]
    },
    {
     "contains": [
      "allow creating file:"
     ]
    },
    {
     "contains": [
      "confirm tool call"
     ]
    },
    {
     "any": [
      {
       "contains": [
        "allow all for this session"
       ]
      },
      {
       "contains": [
        "allow all for every session"
       ]
      },
      {
       "contains": [
        "allow file for every session"
       ]
      },
      {
       "contains": [
        "deny with feedback"
       ]
      }
     ],
     "contains": [
      "approve"
     ]
    }
   ],
   "id": "approval_footer",
   "priority": 300,
   "region": "whole_recent",
   "state": "blocked",
   "visible_blocker": true
  },
  {
   "id": "status_footer_working",
   "line_regex": [
    "(?i)^\\s*╰\\s+\\S+\\s+(thinking|streaming|running tools|waiting)\\s+─"
   ],
   "priority": 200,
   "region": "bottom_non_empty_lines(5)",
   "state": "working",
   "visible_working": true
  },
  {
   "contains": [
    "esc to cancel"
   ],
   "id": "esc_cancel_working",
   "priority": 100,
   "region": "whole_recent",
   "state": "working",
   "visible_working": true
  },
  {
   "contains": [
    " - amp - "
   ],
   "id": "osc_title_idle",
   "not": [
    {
     "regex": [
      "^[\\x{2800}-\\x{28FF}] "
     ]
    },
    {
     "contains": [
      "Plugin confirmation needed"
     ]
    }
   ],
   "priority": 50,
   "region": "osc_title",
   "state": "idle",
   "visible_idle": true
  }
 ],
 "updated_at": "2026-07-09T00:00:00Z",
 "version": "2026.07.09.1"
}