{
 "aliases": [
  "kimi-code",
  "kimi code"
 ],
 "id": "kimi",
 "min_engine_version": 1,
 "rules": [
  {
   "all": [
    {
     "contains": [
      " choose"
     ]
    },
    {
     "any": [
      {
       "contains": [
        "approve"
       ]
      },
      {
       "contains": [
        "reject"
       ]
      },
      {
       "contains": [
        "revise"
       ]
      }
     ]
    }
   ],
   "any": [
    {
     "contains": [
      "run this command?"
     ]
    },
    {
     "contains": [
      "write this file?"
     ]
    },
    {
     "contains": [
      "apply these edits?"
     ]
    },
    {
     "contains": [
      "stop this task?"
     ]
    },
    {
     "contains": [
      "ready to build with this plan?"
     ]
    },
    {
     "line_regex": [
      "(?i)^\\s*▶?\\s*approve .*\\?$"
     ]
    }
   ],
   "contains": [
    "↵ confirm"
   ],
   "id": "current_approval_panel",
   "priority": 400,
   "region": "whole_recent",
   "state": "blocked",
   "visible_blocker": true
  },
  {
   "any": [
    {
     "contains": [
      "↵ choose"
     ]
    },
    {
     "contains": [
      "↵ toggle"
     ]
    },
    {
     "contains": [
      "↵ save"
     ]
    }
   ],
   "contains": [
    "↑↓ select",
    "esc cancel"
   ],
   "id": "question_panel",
   "line_regex": [
    "^\\s*question\\s*$",
    "^\\s*\\? "
   ],
   "priority": 390,
   "region": "whole_recent",
   "state": "blocked",
   "visible_blocker": true
  },
  {
   "all": [
    {
     "any": [
      {
       "contains": [
        "1/2/3/4 choose"
       ]
      },
      {
       "contains": [
        "↵ confirm"
       ]
      }
     ]
    }
   ],
   "any": [
    {
     "contains": [
      "approve once"
     ]
    },
    {
     "contains": [
      "approve for this session"
     ]
    }
   ],
   "contains": [
    "requesting approval",
    "reject"
   ],
   "id": "legacy_approval_panel",
   "priority": 300,
   "region": "whole_recent",
   "state": "blocked"
  },
  {
   "id": "background_agent_status_working",
   "line_regex": [
    "(?i)\\bkimi[-\\w.]*\\s+thinking\\b.*\\[[1-9][0-9]*\\s+agents?\\s+running\\]"
   ],
   "priority": 120,
   "region": "bottom_non_empty_lines(3)",
   "state": "working",
   "visible_working": true
  },
  {
   "id": "moon_spinner_working",
   "line_regex": [
    "^\\s*(🌕|🌖|🌗|🌘|🌑|🌒|🌓|🌔)\\s*$"
   ],
   "priority": 100,
   "region": "whole_recent",
   "state": "working",
   "visible_working": true
  },
  {
   "id": "braille_spinner_working",
   "line_regex": [
    "(?i)^\\s*[\\u2800-\\u28FF]+\\s*(thinking\\.\\.\\.|working\\.\\.\\.|using )"
   ],
   "priority": 90,
   "region": "whole_recent",
   "state": "working",
   "visible_working": true
  }
 ],
 "updated_at": "2026-06-10T00:00:00Z",
 "version": "2026.06.10.1"
}