{
 "aliases": [
  "qoderclicn",
  "qoder",
  "qodercn"
 ],
 "id": "qodercli",
 "min_engine_version": 1,
 "rules": [
  {
   "any": [
    {
     "any": [
      {
       "contains": [
        "yes"
       ]
      },
      {
       "contains": [
        "no"
       ]
      },
      {
       "contains": [
        "allow"
       ]
      },
      {
       "contains": [
        "reject"
       ]
      }
     ],
     "contains": [
      "waiting for user confirmation"
     ]
    },
    {
     "any": [
      {
       "contains": [
        "allow"
       ]
      },
      {
       "contains": [
        "reject"
       ]
      }
     ],
     "contains": [
      "awaiting approval"
     ]
    },
    {
     "contains": [
      "permission required"
     ]
    },
    {
     "contains": [
      "allow once or always?"
     ]
    },
    {
     "contains": [
      "asking user"
     ]
    },
    {
     "contains": [
      "enter your response"
     ]
    },
    {
     "contains": [
      "review your answers:"
     ]
    },
    {
     "contains": [
      "shell awaiting input"
     ]
    }
   ],
   "id": "confirmation_or_input_blocker",
   "priority": 300,
   "region": "whole_recent",
   "state": "blocked",
   "visible_blocker": true
  },
  {
   "contains": [
    "(esc to cancel,"
   ],
   "id": "cancel_hint_working",
   "priority": 100,
   "region": "whole_recent",
   "state": "working",
   "visible_working": true
  },
  {
   "id": "spinner_working",
   "line_regex": [
    "^\\s*[\\u2800-\\u28FF]\\s+.*\\p{Alphabetic}"
   ],
   "priority": 90,
   "region": "whole_recent",
   "state": "working",
   "visible_working": true
  }
 ],
 "updated_at": "2026-06-10T00:00:00Z",
 "version": "2026.06.10.1"
}