{
 "aliases": [
  "herdr:pi"
 ],
 "id": "pi",
 "min_engine_version": 1,
 "rules": [
  {
   "any": [
    {
     "contains": [
      "Working..."
     ]
    },
    {
     "line_regex": [
      "^[⠋⠙⠹⠸⠼⠴⠦⠧⠇⠏] Working$"
     ]
    }
   ],
   "id": "working_literal",
   "priority": 100,
   "region": "whole_recent",
   "state": "working",
   "visible_working": true
  },
  {
   "any": [
    {
     "line_regex": [
      "^── [⠋⠙⠹⠸⠼⠴⠦⠧⠇⠏] Working ─+$"
     ]
    },
    {
     "line_regex": [
      "^[⠋⠙⠹⠸⠼⠴⠦⠧⠇⠏] Working$"
     ]
    }
   ],
   "id": "working_border",
   "priority": 100,
   "region": "bottom_non_empty_lines(12)",
   "state": "working",
   "visible_working": true
  }
 ],
 "updated_at": "2026-10-01T00:00:00Z",
 "version": "2026.10.01.1"
}