{
 "aliases": [
  "open-code",
  "herdr:opencode"
 ],
 "id": "opencode",
 "min_engine_version": 1,
 "rules": [
  {
   "any": [
    {
     "contains": [
      "△ Permission required"
     ]
    },
    {
     "all": [
      {
       "any": [
        {
         "contains": [
          "↑↓ select"
         ]
        },
        {
         "contains": [
          "⇆ tab"
         ]
        }
       ]
      }
     ],
     "any": [
      {
       "contains": [
        "enter confirm"
       ]
      },
      {
       "contains": [
        "enter submit"
       ]
      },
      {
       "contains": [
        "enter toggle"
       ]
      }
     ],
     "contains": [
      "esc dismiss"
     ]
    }
   ],
   "id": "permission_required",
   "priority": 300,
   "region": "whole_recent",
   "state": "blocked",
   "visible_blocker": true
  },
  {
   "any": [
    {
     "contains": [
      "esc to interrupt"
     ]
    },
    {
     "contains": [
      "ctrl+c to interrupt"
     ]
    },
    {
     "contains": [
      "press esc to interrupt"
     ]
    },
    {
     "line_regex": [
      "(?i).*opencode.*esc (again to )?interrupt"
     ]
    }
   ],
   "id": "interrupt_hint_working",
   "priority": 110,
   "region": "whole_recent",
   "state": "working",
   "visible_working": true
  },
  {
   "id": "progress_bar_working",
   "priority": 100,
   "regex": [
    "(■|⬝){4,}"
   ],
   "region": "whole_recent",
   "state": "working",
   "visible_working": true
  }
 ],
 "updated_at": "2026-06-10T00:00:00Z",
 "version": "2026.06.10.1"
}