{
 "id": "codex",
 "min_engine_version": 3,
 "rules": [
  {
   "contains": [
    "Action Required"
   ],
   "id": "osc_title_blocked",
   "priority": 1100,
   "region": "osc_title",
   "state": "blocked",
   "visible_blocker": true
  },
  {
   "id": "osc_title_working",
   "priority": 1050,
   "regex": [
    "(?:^| )[⠋⠙⠹⠸⠼⠴⠦⠧⠇⠏](?: |$)"
   ],
   "region": "osc_title",
   "state": "working",
   "visible_working": true
  },
  {
   "any": [
    {
     "contains": [
      "esc to edit prev"
     ]
    },
    {
     "contains": [
      "esc/← to edit prev"
     ]
    }
   ],
   "contains": [
    "↑/↓ to scroll",
    "pgup/pgdn to",
    "home/end to jump",
    "q to quit"
   ],
   "id": "transcript_viewer",
   "priority": 1000,
   "region": "after_last_prompt_marker",
   "skip_state_update": true,
   "state": "unknown"
  },
  {
   "all": [
    {
     "any": [
      {
       "regex": [
        "\\A> You are in [^\\r\\n]+(?:\\r?\\n|$)"
       ]
      },
      {
       "contains": [
        "Folder access"
       ]
      }
     ]
    },
    {
     "any": [
      {
       "regex": [
        "(?s)Do\\s+you\\s+trust\\s+the\\s+contents\\s+of\\s+this\\s+directory\\?"
       ]
      },
      {
       "all": [
        {
         "contains": [
          "Trust this folder?",
          "Codex can read, edit, and run files here"
         ]
        },
        {
         "any": [
          {
           "contains": [
            "Trust and continue"
           ]
          },
          {
           "contains": [
            "enter continue"
           ]
          }
         ]
        }
       ]
      }
     ]
    }
   ],
   "id": "trust_directory",
   "priority": 950,
   "region": "top_non_empty_lines(20)",
   "state": "blocked",
   "visible_blocker": true
  },
  {
   "any": [
    {
     "all": [
      {
       "contains": [
        "Update available!",
        "Update now"
       ]
      },
      {
       "regex": [
        "Skip\\s+until\\s+next\\s+version",
        "Press enter to continue\\s*\\z"
       ]
      }
     ]
    },
    {
     "all": [
      {
       "regex": [
        "(?m)^\\s*Update\\s+available\\s+·"
       ]
      },
      {
       "regex": [
        "enter\\s+continue\\s+·\\s+esc\\s+skip\\s*\\z"
       ]
      }
     ]
    }
   ],
   "id": "startup_update",
   "priority": 950,
   "region": "bottom_non_empty_lines(20)",
   "state": "blocked",
   "visible_blocker": true
  },
  {
   "any": [
    {
     "contains": [
      "press enter to confirm or esc to cancel"
     ]
    },
    {
     "contains": [
      "enter to submit answer"
     ]
    },
    {
     "contains": [
      "enter to submit all"
     ]
    },
    {
     "contains": [
      "allow command?"
     ]
    },
    {
     "contains": [
      "All Results",
      "Filesystem Only",
      "Plugins"
     ]
    }
   ],
   "id": "live_strong_blocker",
   "priority": 900,
   "region": "after_last_prompt_marker",
   "state": "blocked",
   "visible_blocker": true
  },
  {
   "any": [
    {
     "contains": [
      "[y/n]"
     ]
    },
    {
     "contains": [
      "yes (y)"
     ]
    },
    {
     "any": [
      {
       "contains": [
        "yes"
       ]
      },
      {
       "contains": [
        "❯"
       ]
      }
     ],
     "contains": [
      "do you want to"
     ]
    },
    {
     "any": [
      {
       "contains": [
        "yes"
       ]
      },
      {
       "contains": [
        "❯"
       ]
      }
     ],
     "contains": [
      "would you like to"
     ]
    }
   ],
   "id": "weak_blocker",
   "not": [
    {
     "regex": [
      "(?m)^›[⠁⠂⠄⠈⠐⠠⡀⢀][^\\n]*(?:\\n(?:[^•■✗✓\\n][^\\n]*)?)*\\z"
     ]
    }
   ],
   "priority": 600,
   "region": "whole_recent_without_current_prompt_marker",
   "state": "blocked"
  },
  {
   "any": [
    {
     "contains": [
      " to interrupt)"
     ]
    },
    {
     "contains": [
      "s)"
     ]
    }
   ],
   "id": "screen_working_fallback",
   "not": [
    {
     "line_regex": [
      "^(?:[•◦][ \\t]+)?Reconnect failed — check the endpoint, then relaunch \\([0-9hms ]+\\)$"
     ]
    }
   ],
   "priority": 500,
   "regex": [
    "(?m)^(?:[•◦][ \\t]+)?[^\\s›•◦■✗✓─][^\\r\\n]* \\((?:[0-9]+[hm] )*[0-9]+s(?: • [^\\r\\n]+? to interrupt)?\\)(?: · [^\\r\\n]*)?(?:\\r?\\n(?:[^•◦›■✗✓─\\r\\n][^\\r\\n]*|•[ \\t]+(?:Queued\\s+follow-up\\s+inputs|Messages\\s+to\\s+be\\s+submitted\\s+after\\s+next\\s+tool\\s+call(?:\\s+\\(press\\s+[^\\r\\n]+?\\s+to\\s+interrupt\\s+and\\s+send\\s+immediately\\))?|Messages\\s+to\\s+be\\s+submitted\\s+at\\s+end\\s+of\\s+turn)|›[⠁⠂⠄⠈⠐⠠⡀⢀][^\\r\\n]*)?)*\\s*\\z"
   ],
   "region": "before_current_prompt_marker",
   "state": "working",
   "visible_working": true
  },
  {
   "id": "osc_title_idle",
   "not": [
    {
     "regex": [
      "(?:^| )[⠋⠙⠹⠸⠼⠴⠦⠧⠇⠏](?: |$)"
     ]
    },
    {
     "contains": [
      "Action Required"
     ]
    }
   ],
   "priority": 100,
   "regex": [
    "\\S"
   ],
   "region": "osc_title",
   "state": "idle",
   "visible_idle": true
  }
 ],
 "updated_at": "2026-10-11T00:00:00Z",
 "version": "2026.10.11.1"
}