{
 "id": "cline",
 "min_engine_version": 1,
 "rules": [
  {
   "any": [
    {
     "contains": [
      "let cline use this tool"
     ]
    },
    {
     "contains": [
      "[act mode]",
      "execute command?",
      "yes"
     ]
    },
    {
     "contains": [
      "[act mode]",
      "use this tool?",
      "yes"
     ]
    },
    {
     "contains": [
      "[plan mode]",
      "execute command?",
      "yes"
     ]
    },
    {
     "contains": [
      "[plan mode]",
      "use this tool?",
      "yes"
     ]
    }
   ],
   "id": "tool_permission",
   "priority": 300,
   "region": "whole_recent",
   "state": "blocked",
   "visible_blocker": true
  },
  {
   "id": "default_cline_working",
   "priority": -10,
   "regex": [
    "(?s).+"
   ],
   "region": "whole_recent",
   "state": "working",
   "visible_working": true
  }
 ],
 "updated_at": "2026-06-10T00:00:00Z",
 "version": "2026.06.10.1"
}