{
 "id": "gemini",
 "min_engine_version": 1,
 "rules": [
  {
   "any": [
    {
     "contains": [
      "│ Apply this change"
     ]
    },
    {
     "contains": [
      "│ Allow execution"
     ]
    },
    {
     "all": [
      {
       "contains": [
        "yes"
       ]
      },
      {
       "any": [
        {
         "contains": [
          "waiting for user confirmation"
         ]
        },
        {
         "contains": [
          "│ Do you want to proceed"
         ]
        },
        {
         "contains": [
          "do you want to proceed?"
         ]
        }
       ]
      }
     ]
    },
    {
     "line_regex": [
      "(?i)^\\s*❯.*(yes|allow)"
     ]
    }
   ],
   "id": "apply_or_allow_change",
   "priority": 300,
   "region": "whole_recent",
   "state": "blocked",
   "visible_blocker": true
  },
  {
   "contains": [
    "esc to cancel"
   ],
   "id": "esc_cancel_working",
   "priority": 100,
   "region": "whole_recent",
   "state": "working",
   "visible_working": true
  }
 ],
 "updated_at": "2026-06-10T00:00:00Z",
 "version": "2026.06.10.1"
}