{
 "aliases": [
  "cursor-agent"
 ],
 "id": "cursor",
 "min_engine_version": 1,
 "rules": [
  {
   "any": [
    {
     "contains": [
      "reject & propose changes"
     ]
    },
    {
     "contains": [
      "esc or n or p"
     ]
    },
    {
     "contains": [
      "add write("
     ]
    }
   ],
   "contains": [
    "write to this file?",
    "proceed (y)"
   ],
   "id": "write_file_approval",
   "priority": 320,
   "region": "bottom_non_empty_lines(8)",
   "state": "blocked",
   "visible_blocker": true
  },
  {
   "any": [
    {
     "any": [
      {
       "contains": [
        "run (once) (y)"
       ]
      },
      {
       "contains": [
        "skip (esc or n)"
       ]
      }
     ],
     "contains": [
      "waiting for approval",
      "run this command?"
     ]
    },
    {
     "contains": [
      "(y) (enter)"
     ]
    },
    {
     "line_regex": [
      "(?i)^\\s*allow .*\\(y\\)"
     ]
    },
    {
     "contains": [
      "keep (n)"
     ]
    },
    {
     "contains": [
      "skip (esc or n)"
     ]
    },
    {
     "line_regex": [
      "(?i)^\\s*(?:→\\s*)?run .*\\(y\\)"
     ]
    }
   ],
   "id": "approval_prompt",
   "priority": 300,
   "region": "whole_recent",
   "state": "blocked",
   "visible_blocker": true
  },
  {
   "contains": [
    "ctrl+c to stop"
   ],
   "id": "stop_hint_working",
   "priority": 100,
   "region": "bottom_non_empty_lines(6)",
   "state": "working",
   "visible_working": true
  },
  {
   "id": "background_task_status_working",
   "line_regex": [
    "(?i)\\b[1-9][0-9]*\\s+background\\s+tasks?\\b"
   ],
   "priority": 95,
   "region": "bottom_non_empty_lines(5)",
   "state": "working",
   "visible_working": true
  },
  {
   "id": "spinner_working",
   "line_regex": [
    "^\\s*(⬡|⬢|[\\u2800-\\u28FF]+)\\s+\\p{Alphabetic}+\\w*ing\\b"
   ],
   "priority": 90,
   "region": "bottom_non_empty_lines(8)",
   "state": "working",
   "visible_working": true
  }
 ],
 "updated_at": "2026-08-03T01:08:04Z",
 "version": "2026.08.03.1"
}