{
 "id": "maki",
 "min_engine_version": 1,
 "rules": [
  {
   "any": [
    {
     "contains": [
      "y allow",
      "n deny"
     ]
    },
    {
     "contains": [
      "confirm allow"
     ]
    },
    {
     "contains": [
      "confirm deny"
     ]
    },
    {
     "contains": [
      "enter deny",
      "esc cancel"
     ]
    }
   ],
   "contains": [
    "permission required"
   ],
   "id": "permission_prompt",
   "priority": 980,
   "region": "whole_recent",
   "state": "blocked",
   "visible_blocker": true
  },
  {
   "any": [
    {
     "contains": [
      "space toggle parallel"
     ]
    },
    {
     "contains": [
      "edit plan"
     ]
    }
   ],
   "contains": [
    "plan complete",
    "enter confirm"
   ],
   "id": "plan_complete_form",
   "priority": 970,
   "region": "whole_recent",
   "state": "blocked",
   "visible_blocker": true
  },
  {
   "id": "status_bar_spinner_working",
   "line_regex": [
    "^( [\\x{2800}-\\x{28FF}]){1,2} \\[(BUILD|PLAN|BASH)\\]"
   ],
   "priority": 900,
   "region": "bottom_non_empty_lines(1)",
   "state": "working",
   "visible_working": true
  },
  {
   "id": "status_bar_idle",
   "line_regex": [
    "^ \\[(BUILD|PLAN|BASH)\\]"
   ],
   "priority": 850,
   "region": "bottom_non_empty_lines(1)",
   "state": "idle",
   "visible_idle": true
  },
  {
   "id": "prompt_box_idle",
   "line_regex": [
    "^❯ "
   ],
   "not": [
    {
     "contains": [
      "queue another prompt"
     ]
    },
    {
     "line_regex": [
      "^( [\\x{2800}-\\x{28FF}]){1,2} "
     ]
    }
   ],
   "priority": 840,
   "region": "bottom_non_empty_lines(3)",
   "state": "idle",
   "visible_idle": true
  }
 ],
 "updated_at": "2026-07-09T00:00:00Z",
 "version": "2026.07.09.2"
}