{
 "id": "droid",
 "min_engine_version": 1,
 "rules": [
  {
   "all": [
    {
     "any": [
      {
       "contains": [
        "> yes, allow"
       ]
      },
      {
       "contains": [
        "> no, cancel"
       ]
      }
     ]
    }
   ],
   "any": [
    {
     "contains": [
      "↑↓ to navigate"
     ]
    },
    {
     "contains": [
      "use ↑↓ to navigate"
     ]
    }
   ],
   "contains": [
    "enter to select",
    "esc to cancel"
   ],
   "id": "execute_selection_blocker",
   "priority": 300,
   "region": "whole_recent",
   "state": "blocked",
   "visible_blocker": true
  },
  {
   "any": [
    {
     "contains": [
      "↑/↓ navigate"
     ]
    },
    {
     "contains": [
      "↑↓ navigate"
     ]
    }
   ],
   "contains": [
    "enter select",
    "esc cancel"
   ],
   "id": "selection_menu_blocker",
   "priority": 290,
   "region": "bottom_non_empty_lines(8)",
   "state": "blocked",
   "visible_blocker": true
  },
  {
   "contains": [
    "esc to stop"
   ],
   "id": "spinner_stop_working",
   "line_regex": [
    "^\\s*[\\u2800-\\u28FF]"
   ],
   "priority": 110,
   "region": "whole_recent",
   "state": "working",
   "visible_working": true
  },
  {
   "contains": [
    "esc to stop"
   ],
   "id": "stop_hint_working",
   "priority": 100,
   "region": "whole_recent",
   "state": "working",
   "visible_working": true
  }
 ],
 "updated_at": "2026-06-10T00:00:00Z",
 "version": "2026.06.10.1"
}