{
 "aliases": [
  "antigravity",
  "antigravity-cli"
 ],
 "id": "agy",
 "min_engine_version": 1,
 "rules": [
  {
   "contains": [
    "navigate",
    "tab amend"
   ],
   "id": "permission_prompt",
   "priority": 300,
   "region": "bottom_non_empty_lines(2)",
   "state": "blocked",
   "visible_blocker": true
  },
  {
   "contains": [
    "navigate",
    "esc skip"
   ],
   "id": "question_prompt",
   "priority": 290,
   "region": "bottom_non_empty_lines(2)",
   "state": "blocked",
   "visible_blocker": true
  },
  {
   "contains": [
    "do you trust the contents of this project?",
    "yes, i trust this folder",
    "enter confirm"
   ],
   "id": "trust_prompt",
   "priority": 280,
   "region": "bottom_non_empty_lines(8)",
   "state": "blocked",
   "visible_blocker": true
  },
  {
   "any": [
    {
     "contains": [
      "do you want to proceed?"
     ]
    },
    {
     "contains": [
      "tab amend",
      "edit command"
     ]
    }
   ],
   "contains": [
    "requesting permission for:"
   ],
   "id": "legacy_permission_prompt",
   "priority": 270,
   "region": "whole_recent",
   "state": "blocked",
   "visible_blocker": true
  },
  {
   "id": "esc_cancel_footer_working",
   "priority": 110,
   "regex": [
    "(?m)^\\s*─{3,}\\s*esc to cancel\\b"
   ],
   "region": "bottom_non_empty_lines(2)",
   "state": "working",
   "visible_working": true
  },
  {
   "id": "spinner_working",
   "line_regex": [
    "^\\s*[\\u2801-\\u28FF]+\\s+\\S"
   ],
   "priority": 100,
   "region": "bottom_non_empty_lines(12)",
   "state": "working",
   "visible_working": true
  }
 ],
 "updated_at": "2026-10-05T00:00:00Z",
 "version": "2026.10.05.1"
}