{
 "aliases": [
  "grok-build"
 ],
 "id": "grok",
 "min_engine_version": 3,
 "rules": [
  {
   "contains": [
    "Action Required"
   ],
   "id": "osc_title_blocked",
   "priority": 1300,
   "region": "osc_title",
   "state": "blocked",
   "visible_blocker": true
  },
  {
   "id": "option_dialog_blocked",
   "line_regex": [
    "^\\s*┃\\s+[0-9a-z]+\\s+\\([●○]\\)\\s"
   ],
   "priority": 1200,
   "region": "whole_recent",
   "state": "blocked",
   "visible_blocker": true
  },
  {
   "contains": [
    ":select",
    "ctrl+o:yolo",
    "ctrl+c:cancel"
   ],
   "id": "permission_hints_blocked",
   "priority": 1190,
   "region": "bottom_non_empty_lines(2)",
   "state": "blocked",
   "visible_blocker": true
  },
  {
   "contains": [
    "tab:scrollback",
    "shift+x:dismiss"
   ],
   "id": "question_dialog_hints_blocked",
   "priority": 1185,
   "region": "bottom_non_empty_lines(2)",
   "state": "blocked",
   "visible_blocker": true
  },
  {
   "any": [
    {
     "contains": [
      "use ← → to choose permission whitelist scope"
     ]
    },
    {
     "contains": [
      "←/→:scope"
     ]
    }
   ],
   "contains": [
    "yes, proceed",
    "no, reject"
   ],
   "id": "permission_scope_selector",
   "priority": 1180,
   "region": "whole_recent",
   "state": "blocked",
   "visible_blocker": true
  },
  {
   "id": "osc_progress_working",
   "priority": 1150,
   "regex": [
    "^4;1;-1$"
   ],
   "region": "osc_progress",
   "state": "working",
   "visible_working": true
  },
  {
   "id": "osc_title_idle",
   "not": [
    {
     "regex": [
      "[\\x{2800}-\\x{28FF}]"
     ]
    }
   ],
   "priority": 1100,
   "regex": [
    "(?:^| - )grok$"
   ],
   "region": "osc_title",
   "state": "idle",
   "visible_idle": true
  },
  {
   "id": "osc_title_working",
   "priority": 1000,
   "regex": [
    "(?:^|\\s)[\\x{2801}-\\x{28FF}](?:\\s|$)"
   ],
   "region": "osc_title",
   "state": "working",
   "visible_working": true
  },
  {
   "id": "osc_progress_idle",
   "priority": 950,
   "regex": [
    "^4;0;0$"
   ],
   "region": "osc_progress",
   "state": "idle",
   "visible_idle": true
  },
  {
   "id": "spinner_status_working",
   "line_regex": [
    "^\\s*[\\x{2801}-\\x{28FF}]\\s.*\\[stop\\]\\s*$"
   ],
   "priority": 1160,
   "region": "whole_recent",
   "state": "working",
   "visible_working": true
  },
  {
   "any": [
    {
     "contains": [
      "esc:cancel"
     ]
    },
    {
     "contains": [
      "ctrl+c:cancel"
     ]
    }
   ],
   "contains": [
    "ctrl+.:shortcuts"
   ],
   "id": "esc_cancel_hints_working",
   "priority": 1155,
   "region": "bottom_non_empty_lines(2)",
   "state": "working",
   "visible_working": true
  },
  {
   "any": [
    {
     "all": [
      {
       "contains": [
        "ctrl+c:cancel",
        "ctrl+enter:interject"
       ]
      },
      {
       "contains": [
        "waiting"
       ]
      }
     ]
    },
    {
     "line_regex": [
      "^\\s*[\\x{2801}-\\x{28FF}]\\s+(Run|Read|Search|List)\\b"
     ]
    }
   ],
   "id": "waiting_tool_working",
   "priority": 1140,
   "region": "whole_recent",
   "state": "working",
   "visible_working": true
  },
  {
   "contains": [
    "ctrl+.:shortcuts"
   ],
   "id": "prompt_hints_idle",
   "not": [
    {
     "contains": [
      "esc:cancel"
     ]
    },
    {
     "contains": [
      "ctrl+c:cancel"
     ]
    }
   ],
   "priority": 100,
   "region": "bottom_non_empty_lines(2)",
   "state": "idle",
   "visible_idle": true
  }
 ],
 "updated_at": "2026-10-05T00:00:00Z",
 "version": "2026.10.05.1"
}