{
 "aliases": [
  "kilo-code",
  "kilo code",
  "herdr:kilo"
 ],
 "id": "kilo",
 "min_engine_version": 1,
 "rules": [
  {
   "any": [
    {
     "contains": [
      "△ Permission required"
     ]
    },
    {
     "all": [
      {
       "any": [
        {
         "contains": [
          "↑↓ select"
         ]
        },
        {
         "contains": [
          "⇆ tab"
         ]
        }
       ]
      }
     ],
     "any": [
      {
       "contains": [
        "enter confirm"
       ]
      },
      {
       "contains": [
        "enter submit"
       ]
      },
      {
       "contains": [
        "enter toggle"
       ]
      }
     ],
     "contains": [
      "esc dismiss"
     ]
    }
   ],
   "id": "opencode_permission",
   "priority": 300,
   "region": "whole_recent",
   "state": "blocked",
   "visible_blocker": true
  },
  {
   "contains": [
    "esc interrupt"
   ],
   "id": "esc_interrupt_working",
   "priority": 100,
   "region": "whole_recent",
   "state": "working",
   "visible_working": true
  }
 ],
 "updated_at": "2026-06-10T00:00:00Z",
 "version": "2026.06.10.1"
}